<?xml version="1.0" encoding="UTF-8"?>
<marcadores xmlns:xsi="http://www.w3.org/2001/XMLSchema-instance"
xsi:noNamespaceSchemaLocation="proba.xsd">
   <pagina>
      <nombre>Abrirllave</nombre>
      <descripcion>Tutoriales de informática.</descripcion>
      <url>http://www.abrirllave.com/</url>
   </pagina>
   <pagina>
      <nombre>Wikipedia</nombre>
      <descripcion>La enciclopedia libre.</descripcion>
      <url>http://www.wikipedia.org/</url>
      <option value="hola">dfdffd</option>
   </pagina>
   <pagina>
      <nombre>W3C</nombre>
      <descripcion>World Wide Web Consortium.</descripcion>
      <url>http://www.w3.org/</url>
      <option value="hola">dfdffd</option>
  </pagina>
</marcadores>